[
  {
    "id": "dsa5104-projects",
    "courseCode": "DSA5104",
    "title": "Four projects",
    "kind": "project",
    "weight": 60,
    "date": null,
    "dateStatus": "pending",
    "source": {
      "sourceId": "DSA5104/chapter1.pdf",
      "page": 6
    },
    "checklist": [
      "Confirm project briefs",
      "Create schema/query checklist",
      "Run SQL practice",
      "Record open questions"
    ]
  },
  {
    "id": "dsa5104-final",
    "courseCode": "DSA5104",
    "title": "Final closed-book exam",
    "kind": "exam",
    "weight": 40,
    "date": "2026-11-30T13:00:00+08:00",
    "dateStatus": "confirmed",
    "source": {
      "sourceId": "DSA5104/chapter1.pdf",
      "page": 6
    },
    "checklist": [
      "Prepare allowed A4 cheat sheet",
      "Practice SQL by hand",
      "Review ER and normalization",
      "Do timed paper"
    ]
  }
]
